{
  "schemaVersion": "1.0.0",
  "eventId": "11111111-1111-4111-8111-111111111111",
  "planetId": "22222222-2222-4222-8222-222222222222",
  "trigger": {
    "kind": "mock",
    "mockSubmissionId": "33333333-3333-4333-8333-333333333333",
    "archiveEntryId": "55555555-5555-4555-8555-555555555555",
    "idempotencyKey": "mock:22222222-2222-4222-8222-222222222222:33333333-3333-4333-8333-333333333333"
  },
  "baseRevision": 7,
  "status": "accepted",
  "summary": "根据示例作品的青绿色调，在内部场景增加一朵缓慢呼吸的发光花。",
  "elements": [
    {
      "layerId": "44444444-4444-4444-8444-444444444444",
      "sceneKind": "interior",
      "presetId": "glow-flower",
      "presetVersion": "1.0.0",
      "params": {
        "x": 0.62,
        "y": 0.74,
        "scale": 0.8,
        "rotationDeg": -5,
        "color": "#6DE1C2",
        "opacity": 0.9,
        "glowIntensity": 0.45,
        "motionSpeed": 0.3,
        "seed": 42
      }
    }
  ],
  "createdAt": "2026-10-09T03:00:00Z",
  "acceptedAt": "2026-10-09T03:01:00Z",
  "appliedRevision": 8,
  "revertedAt": null,
  "revertedRevision": null,
  "provider": {
    "kind": "mock",
    "adapter": "deterministic-mock-v1",
    "model": "none",
    "promptVersion": "mock-v1"
  },
  "policyVersion": "growth-policy-v1"
}
